<?xml version="1.0" encoding="UTF-8"?>
<Experiments
    name="Smoke Tests"
    description="Simple set of smoke tests to validate the integration of an FMU into a simulation engine."
    xmlns="http://modelica.org/HSExperiments1/HSExperiments"
    xmlns:xsi="http://www.w3.org/2001/XMLSchema-instance"
    xsi:schemaLocation="http://modelica.org/HSExperiments1/HSExperiments ../../schema/maHarmonizedSpecificationExperiments.xsd">
    <TransientExperiment
        name="Test1"
        description="Baseline steady-state test"
        startTime="0.0"
        stopTime="10.0"
        stepSize="0.001"
        tolerance="0.004">
        <Stimuli
            source="test1-in.csv" />
        <References
            source="test1-ref.csv" />
    </TransientExperiment>
    <TransientExperiment
        name="Test2"
        description="Baseline dynamic test"
        startTime="0.0"
        stopTime="15.0"
        stepSize="0.010">
        <Parameters
            source="dynamic-params.ssv" />
        <Stimuli
            source="test2-in.csv" />
        <References
            source="test2-ref.hdf5"
            type="application/hdf5" />
    </TransientExperiment>
</Experiments>
